{
  "schemaVersion": "1.0.0",
  "id": "finance:ocpf:ma:2026",
  "kind": "finance_dataset",
  "provider": {
    "id": "ocpf",
    "name": "Massachusetts Office of Campaign and Political Finance Public API",
    "jurisdiction": "Massachusetts",
    "documentationUrl": "https://api.ocpf.us/developers/guide"
  },
  "status": "partial",
  "period": {
    "cycle": 2026,
    "startDate": "2026-01-01",
    "endDate": "2026-07-31",
    "asOf": "2026-07-31"
  },
  "candidates": [
    {
      "candidateId": "andrea-campbell",
      "status": "partial",
      "provider": {
        "id": "ocpf",
        "entityId": "15931"
      },
      "identity": {
        "filerName": "Andrea Joy Campbell",
        "committeeName": "Campbell Committee",
        "office": "Attorney General",
        "party": "Democratic",
        "matchStatus": "automated_checks_passed"
      },
      "period": {
        "startDate": "2026-01-01",
        "endDate": "2026-07-31",
        "cycle": 2026,
        "asOf": "2026-07-31",
        "basis": "year_to_date",
        "reportId": "1036466"
      },
      "totals": {
        "receipts": {
          "status": "known",
          "value": 576755.15,
          "currency": "USD",
          "sourceRecordRefs": [
            "ocpf:15931:report:1036466"
          ],
          "note": null
        },
        "disbursements": {
          "status": "known",
          "value": 556446.11,
          "currency": "USD",
          "sourceRecordRefs": [
            "ocpf:15931:report:1036466"
          ],
          "note": null
        },
        "cashOnHand": {
          "status": "known",
          "value": 866409.45,
          "currency": "USD",
          "sourceRecordRefs": [
            "ocpf:15931:report:1036466"
          ],
          "note": null
        },
        "debtsOwed": {
          "status": "not_available",
          "value": null,
          "currency": "USD",
          "sourceRecordRefs": [],
          "note": "The OCPF filer YTD payload used by this adapter does not expose debts owed."
        }
      },
      "receiptComposition": {
        "status": "not_researched",
        "value": null,
        "sourceRecordRefs": [],
        "note": "Receipt-level category aggregation is outside this bounded first-pass adapter."
      },
      "outsideSpending": {
        "status": "not_researched",
        "value": null,
        "sourceRecordRefs": [],
        "note": "Independent spending requires OCPF miscellaneous-report endpoints and has not been joined yet."
      },
      "timeSeries": {
        "receipts": {
          "status": "not_researched",
          "value": null,
          "currency": "USD",
          "sourceRecordRefs": [],
          "note": "Monthly receipt history has not been materialized from report-level records yet."
        },
        "disbursements": {
          "status": "not_researched",
          "value": null,
          "currency": "USD",
          "sourceRecordRefs": [],
          "note": "Monthly disbursement history has not been materialized from report-level records yet."
        },
        "cashOnHand": {
          "status": "not_researched",
          "value": null,
          "currency": "USD",
          "sourceRecordRefs": [],
          "note": "Historical cash balances have not been materialized from report-level records yet."
        }
      },
      "comparability": {
        "status": "limited",
        "basis": "OCPF filer-specific year-to-date summary; compare only records with matching periods and account rules.",
        "key": "ocpf:ytd:2026-01-01:2026-07-31",
        "caveats": [
          "Year-to-date totals are not lifetime or full election-cycle totals.",
          "Candidates may use different OCPF account types and reporting schedules.",
          "A missing value is not zero and must not be ranked as zero."
        ]
      },
      "source": {
        "sourceId": "source:ocpf-public-api",
        "recordId": "ocpf:15931:report:1036466",
        "url": "https://api.ocpf.us/filer/payload/15931",
        "retrievedAt": "2026-08-24T13:30:00.000Z",
        "contentHash": "sha256:8463ae62e0faf1ff895137aa07d88054176ed8ec3b1078d50b452c7330b661c1"
      },
      "provenance": {
        "method": "deterministic_derivation",
        "sourceIds": [
          "source:ocpf-public-api"
        ],
        "evidenceIds": [],
        "producedAt": "2026-08-24T13:30:00.000Z",
        "generator": {
          "kind": "script",
          "name": "scripts/materialize-finance-data.mjs",
          "version": "1.0.0"
        },
        "codeRevision": "a72b34cfab9fdac4a90a6ce8e0872eea1a9cf91c"
      },
      "freshness": {
        "status": "current",
        "checkedAt": "2026-08-24T13:30:00.000Z",
        "sourceChangedAt": "2026-08-24T13:30:00.000Z",
        "dataUpdatedAt": "2026-08-24T13:30:00.000Z",
        "validThrough": null
      },
      "review": {
        "status": "needs_review",
        "reviewedAt": null,
        "reviewer": null,
        "notes": [
          "Provider identity checks passed; a maintainer has not yet marked this finance view human-reviewed."
        ]
      },
      "synthesisRefs": []
    },
    {
      "candidateId": "barry-finegold",
      "status": "partial",
      "provider": {
        "id": "ocpf",
        "entityId": "13045"
      },
      "identity": {
        "filerName": "Barry R. Finegold",
        "committeeName": "Finegold Committee",
        "office": "Senate, 2nd Essex & Middlesex",
        "party": "Democratic",
        "matchStatus": "automated_checks_passed"
      },
      "period": {
        "startDate": "2026-01-01",
        "endDate": "2026-07-31",
        "cycle": 2026,
        "asOf": "2026-07-31",
        "basis": "year_to_date",
        "reportId": "1036443"
      },
      "totals": {
        "receipts": {
          "status": "known",
          "value": 229191.78,
          "currency": "USD",
          "sourceRecordRefs": [
            "ocpf:13045:report:1036443"
          ],
          "note": null
        },
        "disbursements": {
          "status": "known",
          "value": 58879.87,
          "currency": "USD",
          "sourceRecordRefs": [
            "ocpf:13045:report:1036443"
          ],
          "note": null
        },
        "cashOnHand": {
          "status": "known",
          "value": 594377.49,
          "currency": "USD",
          "sourceRecordRefs": [
            "ocpf:13045:report:1036443"
          ],
          "note": null
        },
        "debtsOwed": {
          "status": "not_available",
          "value": null,
          "currency": "USD",
          "sourceRecordRefs": [],
          "note": "The OCPF filer YTD payload used by this adapter does not expose debts owed."
        }
      },
      "receiptComposition": {
        "status": "not_researched",
        "value": null,
        "sourceRecordRefs": [],
        "note": "Receipt-level category aggregation is outside this bounded first-pass adapter."
      },
      "outsideSpending": {
        "status": "not_researched",
        "value": null,
        "sourceRecordRefs": [],
        "note": "Independent spending requires OCPF miscellaneous-report endpoints and has not been joined yet."
      },
      "timeSeries": {
        "receipts": {
          "status": "not_researched",
          "value": null,
          "currency": "USD",
          "sourceRecordRefs": [],
          "note": "Monthly receipt history has not been materialized from report-level records yet."
        },
        "disbursements": {
          "status": "not_researched",
          "value": null,
          "currency": "USD",
          "sourceRecordRefs": [],
          "note": "Monthly disbursement history has not been materialized from report-level records yet."
        },
        "cashOnHand": {
          "status": "not_researched",
          "value": null,
          "currency": "USD",
          "sourceRecordRefs": [],
          "note": "Historical cash balances have not been materialized from report-level records yet."
        }
      },
      "comparability": {
        "status": "limited",
        "basis": "OCPF filer-specific year-to-date summary; compare only records with matching periods and account rules.",
        "key": "ocpf:ytd:2026-01-01:2026-07-31",
        "caveats": [
          "Year-to-date totals are not lifetime or full election-cycle totals.",
          "Candidates may use different OCPF account types and reporting schedules.",
          "A missing value is not zero and must not be ranked as zero."
        ]
      },
      "source": {
        "sourceId": "source:ocpf-public-api",
        "recordId": "ocpf:13045:report:1036443",
        "url": "https://api.ocpf.us/filer/payload/13045",
        "retrievedAt": "2026-08-24T13:30:00.000Z",
        "contentHash": "sha256:c11a48943f4393a9a985487429f3554aff23059d2d9b5443357689169f7e3cf7"
      },
      "provenance": {
        "method": "deterministic_derivation",
        "sourceIds": [
          "source:ocpf-public-api"
        ],
        "evidenceIds": [],
        "producedAt": "2026-08-24T13:30:00.000Z",
        "generator": {
          "kind": "script",
          "name": "scripts/materialize-finance-data.mjs",
          "version": "1.0.0"
        },
        "codeRevision": "a72b34cfab9fdac4a90a6ce8e0872eea1a9cf91c"
      },
      "freshness": {
        "status": "current",
        "checkedAt": "2026-08-24T13:30:00.000Z",
        "sourceChangedAt": "2026-08-24T13:30:00.000Z",
        "dataUpdatedAt": "2026-08-24T13:30:00.000Z",
        "validThrough": null
      },
      "review": {
        "status": "needs_review",
        "reviewedAt": null,
        "reviewer": null,
        "notes": [
          "Provider identity checks passed; a maintainer has not yet marked this finance view human-reviewed."
        ]
      },
      "synthesisRefs": []
    },
    {
      "candidateId": "brian-shortsleeve",
      "status": "partial",
      "provider": {
        "id": "ocpf",
        "entityId": "19172"
      },